{
  "schema_version": "1.0.0",
  "record_id": "EVID-REL-0002-TECH-ANTI-FILLER",
  "record_type": "technical_validation",
  "release_id": "REL-0002",
  "template_id": "TMPL-0002",
  "version": "1.0.0",
  "descriptor_sha256": "2d44a466e4c4a5da4bf0203b89ce6af3fcffe8a2e7e61ac6324f12bc7882472b",
  "native_asset_sha256s": [
    "1a922e87a29682bdea8a04734084f9f9fe1631bf785139b95b2b0f74c238818f"
  ],
  "verdict": "VALIDATION_PASS",
  "actor_id": "syn-validation-runner-2026-08-29",
  "actor": "Syn Studios validation runner",
  "observations": [
    "Deterministic anti_filler checks inspected the frozen descriptor and every native asset byte."
  ],
  "artifacts": [
    {
      "path": "evidence/template-releases/REL-0002/technical-results/anti_filler.json",
      "sha256": "1ce92db37c860b05ff174a0a86c1fa55a318aa6bf111d656fbaed2f47b4a1189",
      "media_type": "application/json",
      "category": "anti_filler"
    }
  ],
  "summary": "Category-specific anti_filler validation completed against the frozen release inputs.",
  "categories": [
    "anti_filler"
  ],
  "procedures": {
    "anti_filler": "Map each section and appendix to an issue, source, decision, or review need."
  }
}
