{
  "schema_version": "1.0.0",
  "record_id": "EVID-REL-0002-CONDUCTOR",
  "record_type": "conductor_approval",
  "release_id": "REL-0002",
  "template_id": "TMPL-0002",
  "version": "1.0.0",
  "descriptor_sha256": "2d44a466e4c4a5da4bf0203b89ce6af3fcffe8a2e7e61ac6324f12bc7882472b",
  "native_asset_sha256s": [
    "1a922e87a29682bdea8a04734084f9f9fe1631bf785139b95b2b0f74c238818f"
  ],
  "verdict": "APPROVED",
  "actor_id": "syn-codex-conductor-2026-08-29",
  "actor": "Syn Studios Codex conductor",
  "observations": [
    "Conductor approval was explicitly supplied after Terra, Sol, and technical evidence were bound."
  ],
  "artifacts": [
    {
      "path": "evidence/template-releases/REL-0002/proofs/conductor.txt",
      "sha256": "11e0d5cb17d8156177ae9a4288dce0b71ac3c95ac556b8ee89ea839cba74b4d4",
      "media_type": "text/plain",
      "category": "provenance"
    }
  ],
  "summary": "Explicit conductor approval for publication of this frozen template version."
}
