{
  "schema_version": "1.0.0",
  "record_id": "EVID-REL-0001-TECH-AUTHORITY-SEPARATION",
  "record_type": "technical_validation",
  "release_id": "REL-0001",
  "template_id": "TMPL-0001",
  "version": "1.0.0",
  "descriptor_sha256": "642d3c4d81d898667606140d4f50ca0c040f66c2bf602312bc57a40aea318c7c",
  "native_asset_sha256s": [
    "2b439f61fce015d4d3b3c78368e8deb66b8ca811d799339c848c83c47edbdf66"
  ],
  "verdict": "VALIDATION_PASS",
  "actor_id": "syn-validation-runner-2026-08-29",
  "actor": "Syn Studios validation runner",
  "observations": [
    "The blueprint authority_separation gate was executed for the frozen artifact set."
  ],
  "artifacts": [
    {
      "path": "evidence/template-releases/REL-0001/proofs/technical-authority_separation.txt",
      "sha256": "466c351f3efc43d3fe0a276a4e46bfb314a18dca4ed5e413714dc91b5fa684ab",
      "media_type": "text/plain",
      "category": "authority_separation"
    }
  ],
  "summary": "Technical validation result for the authority_separation release gate.",
  "categories": [
    "authority_separation"
  ],
  "procedures": {
    "authority_separation": "Confirm supporting work is distinct from governing ledger and approvals."
  }
}
