{
  "schema_version": "1.0.0",
  "record_id": "EVID-REL-0003-TECH-METADATA",
  "record_type": "technical_validation",
  "release_id": "REL-0003",
  "template_id": "TMPL-0003",
  "version": "1.0.0",
  "descriptor_sha256": "850e4665fc96a18aab826296243c6f86e0af3833f1dea60547a62049e2559dfe",
  "native_asset_sha256s": [
    "8acaf754686fa23b1bbc59d229094d6444b54224ea9a0dae53c50086b8c5bf99"
  ],
  "verdict": "VALIDATION_PASS",
  "actor_id": "syn-validation-runner-2026-08-29",
  "actor": "Syn Studios validation runner",
  "observations": [
    "Deterministic metadata checks inspected the frozen descriptor and all 1 bound native assets."
  ],
  "artifacts": [
    {
      "path": "evidence/template-releases/REL-0003/technical-results/metadata.json",
      "sha256": "86c0e82542e9f69b9ebce55804cf24d30d902d989eab9bda28001481d9546bc1",
      "media_type": "application/json",
      "category": "metadata"
    }
  ],
  "summary": "Category-specific metadata validation completed against the frozen release inputs.",
  "categories": [
    "metadata"
  ],
  "procedures": {
    "metadata": "Inspect MIME headers, message identifiers, timestamps, encodings, and attachment names."
  }
}
