{
  "schema_version": "1.0.0",
  "record_id": "EVID-REL-0003-TECH-AUTHORITY-SEPARATION",
  "record_type": "technical_validation",
  "release_id": "REL-0003",
  "template_id": "TMPL-0003",
  "version": "1.0.0",
  "descriptor_sha256": "850e4665fc96a18aab826296243c6f86e0af3833f1dea60547a62049e2559dfe",
  "native_asset_sha256s": [
    "8acaf754686fa23b1bbc59d229094d6444b54224ea9a0dae53c50086b8c5bf99"
  ],
  "verdict": "VALIDATION_PASS",
  "actor_id": "syn-validation-runner-2026-08-29",
  "actor": "Syn Studios validation runner",
  "observations": [
    "The blueprint authority_separation gate was executed for the frozen artifact set."
  ],
  "artifacts": [
    {
      "path": "evidence/template-releases/REL-0003/proofs/technical-authority_separation.txt",
      "sha256": "2c9f624b6d9062af6c5b0501457e0a4dee44de2813d71a1e44109f997185d43f",
      "media_type": "text/plain",
      "category": "authority_separation"
    }
  ],
  "summary": "Technical validation result for the authority_separation release gate.",
  "categories": [
    "authority_separation"
  ],
  "procedures": {
    "authority_separation": "Distinguish contextual correspondence, corrected support, and any governing attachment."
  }
}
