{
  "schema_version": "1.0.0",
  "record_id": "EVID-REL-0001-TECH-METADATA",
  "record_type": "technical_validation",
  "release_id": "REL-0001",
  "template_id": "TMPL-0001",
  "version": "1.0.0",
  "descriptor_sha256": "642d3c4d81d898667606140d4f50ca0c040f66c2bf602312bc57a40aea318c7c",
  "native_asset_sha256s": [
    "2b439f61fce015d4d3b3c78368e8deb66b8ca811d799339c848c83c47edbdf66"
  ],
  "verdict": "VALIDATION_PASS",
  "actor_id": "syn-validation-runner-2026-08-29",
  "actor": "Syn Studios validation runner",
  "observations": [
    "Deterministic metadata checks inspected the frozen descriptor and all 1 bound native assets."
  ],
  "artifacts": [
    {
      "path": "evidence/template-releases/REL-0001/technical-results/metadata.json",
      "sha256": "181f655ce18dbb17171f166198d74ed59062776fc186078587a58f4e61746cd2",
      "media_type": "application/json",
      "category": "metadata"
    }
  ],
  "summary": "Category-specific metadata validation completed against the frozen release inputs.",
  "categories": [
    "metadata"
  ],
  "procedures": {
    "metadata": "Inspect properties, hidden content, comments, names, links, and external connections."
  }
}
