{
  "schema_version": "1.0.0",
  "record_id": "EVID-REL-0002-TECH-RENDER",
  "record_type": "technical_validation",
  "release_id": "REL-0002",
  "template_id": "TMPL-0002",
  "version": "1.0.0",
  "descriptor_sha256": "2d44a466e4c4a5da4bf0203b89ce6af3fcffe8a2e7e61ac6324f12bc7882472b",
  "native_asset_sha256s": [
    "1a922e87a29682bdea8a04734084f9f9fe1631bf785139b95b2b0f74c238818f"
  ],
  "verdict": "VALIDATION_PASS",
  "actor_id": "syn-validation-runner-2026-08-29",
  "actor": "Syn Studios validation runner",
  "observations": [
    "Deterministic render checks inspected the frozen descriptor and all 1 bound native assets."
  ],
  "artifacts": [
    {
      "path": "evidence/template-releases/REL-0002/technical-results/render.json",
      "sha256": "a7d52315a1bb829b1f7672b5a11c6e90cbb08bc37f29d75e431df25cc4cd1395",
      "media_type": "application/json",
      "category": "provenance"
    },
    {
      "path": "evidence/template-releases/REL-0002/render/internal-controller-memo.pdf",
      "sha256": "7ab74990636dc585a29f83c681181c8eacf6b1a24327a40404209b4ce861049c",
      "media_type": "application/pdf",
      "category": "render"
    },
    {
      "path": "evidence/template-releases/REL-0002/render/internal-controller-memo-page-1.png",
      "sha256": "64f0116a42619297fd083a1563533d6d756c06d8fa389ad446377c4da7e60110",
      "media_type": "image/png",
      "category": "render"
    },
    {
      "path": "evidence/template-releases/REL-0002/render/internal-controller-memo-page-2.png",
      "sha256": "5a2e3c005c8006922805fa987fa0f4fd415343a2a46b0778656e0e9a2718d124",
      "media_type": "image/png",
      "category": "render"
    },
    {
      "path": "evidence/template-releases/REL-0002/render/internal-controller-memo-page-3.png",
      "sha256": "d905e8e2c9c9e4605ed30b3bd96f1d7d134f6311ee78e66c2a1cb54d37d3a71e",
      "media_type": "image/png",
      "category": "render"
    },
    {
      "path": "evidence/template-releases/REL-0002/render/internal-controller-memo-page-4.png",
      "sha256": "ce46e2c58b2f91a2d89fd850a070eddeac641e71123803481f59f286b7c2985f",
      "media_type": "image/png",
      "category": "render"
    },
    {
      "path": "evidence/template-releases/REL-0002/render/internal-controller-memo-page-5.png",
      "sha256": "9339112c00651ce29edc8f93849090c62ee9814d448a8d07bdfd6f05ca40ab65",
      "media_type": "image/png",
      "category": "render"
    }
  ],
  "summary": "Category-specific render validation completed against the frozen release inputs.",
  "categories": [
    "render"
  ],
  "procedures": {
    "render": "Render and inspect every page, appendix, header, footer, and comment anchor."
  },
  "render_contract_sha256": "ef4faa3dbba264870c11eb870c04a2c6e4d9e770512e26039d2819b909c0aa1d"
}
