{
  "schema_version": "1.0.0",
  "record_id": "EVID-REL-0002-TECH-PROVENANCE",
  "record_type": "technical_validation",
  "release_id": "REL-0002",
  "template_id": "TMPL-0002",
  "version": "1.0.0",
  "descriptor_sha256": "2d44a466e4c4a5da4bf0203b89ce6af3fcffe8a2e7e61ac6324f12bc7882472b",
  "native_asset_sha256s": [
    "1a922e87a29682bdea8a04734084f9f9fe1631bf785139b95b2b0f74c238818f"
  ],
  "verdict": "VALIDATION_PASS",
  "actor_id": "syn-validation-runner-2026-08-29",
  "actor": "Syn Studios validation runner",
  "observations": [
    "Deterministic provenance checks inspected the frozen descriptor and all 1 bound native assets."
  ],
  "artifacts": [
    {
      "path": "evidence/template-releases/REL-0002/technical-results/provenance.json",
      "sha256": "1e3fae80927560f4e1c590b0f50d8ff8dba7c8ddc4d27e909370dbe72587fd99",
      "media_type": "application/json",
      "category": "provenance"
    }
  ],
  "summary": "Category-specific provenance validation completed against the frozen release inputs.",
  "categories": [
    "provenance"
  ],
  "procedures": {
    "provenance": "Trace every cited fact and attachment to the approved fictional-world manifest."
  }
}
