{
  "schema_version": "1.0.0",
  "record_id": "EVID-REL-0001-TECH-PROVENANCE",
  "record_type": "technical_validation",
  "release_id": "REL-0001",
  "template_id": "TMPL-0001",
  "version": "1.0.0",
  "descriptor_sha256": "642d3c4d81d898667606140d4f50ca0c040f66c2bf602312bc57a40aea318c7c",
  "native_asset_sha256s": [
    "2b439f61fce015d4d3b3c78368e8deb66b8ca811d799339c848c83c47edbdf66"
  ],
  "verdict": "VALIDATION_PASS",
  "actor_id": "syn-validation-runner-2026-08-29",
  "actor": "Syn Studios validation runner",
  "observations": [
    "Deterministic provenance checks inspected the frozen descriptor and every native asset byte."
  ],
  "artifacts": [
    {
      "path": "evidence/template-releases/REL-0001/technical-results/provenance.json",
      "sha256": "8edc769c44a424fe47ab51d92a38b0cf99528ec90b655585048ff6164d87efaa",
      "media_type": "application/json",
      "category": "provenance"
    }
  ],
  "summary": "Category-specific provenance validation completed against the frozen release inputs.",
  "categories": [
    "provenance"
  ],
  "procedures": {
    "provenance": "Trace every input population to the approved fictional-world source manifest."
  }
}
