{
  "schema_version": "1.0.0",
  "record_id": "EVID-REL-0002-BUILD",
  "record_type": "build_attestation",
  "release_id": "REL-0002",
  "template_id": "TMPL-0002",
  "version": "1.0.0",
  "descriptor_sha256": "2d44a466e4c4a5da4bf0203b89ce6af3fcffe8a2e7e61ac6324f12bc7882472b",
  "native_asset_sha256s": [
    "1a922e87a29682bdea8a04734084f9f9fe1631bf785139b95b2b0f74c238818f"
  ],
  "verdict": "BUILD_COMPLETE",
  "actor_id": "syn-build-lane-b8efe82",
  "actor": "Syn Studios template build lane",
  "observations": [
    "Frozen descriptor and native asset hashes were recomputed before release assembly."
  ],
  "artifacts": [
    {
      "path": "evidence/template-releases/REL-0002/proofs/build.txt",
      "sha256": "a0a13455be5bf59c17de154c7da17de410214523f5b4c3cf5ae702268a366b1f",
      "media_type": "text/plain",
      "category": "core_integrity"
    }
  ],
  "summary": "Deterministic build attestation for the frozen template bytes."
}
