{
  "schema_version": "1.0.0",
  "record_id": "EVID-REL-0003-TECH-PROVENANCE",
  "record_type": "technical_validation",
  "release_id": "REL-0003",
  "template_id": "TMPL-0003",
  "version": "1.0.0",
  "descriptor_sha256": "850e4665fc96a18aab826296243c6f86e0af3833f1dea60547a62049e2559dfe",
  "native_asset_sha256s": [
    "8acaf754686fa23b1bbc59d229094d6444b54224ea9a0dae53c50086b8c5bf99"
  ],
  "verdict": "VALIDATION_PASS",
  "actor_id": "syn-validation-runner-2026-08-29",
  "actor": "Syn Studios validation runner",
  "observations": [
    "Deterministic provenance checks inspected the frozen descriptor and every native asset byte."
  ],
  "artifacts": [
    {
      "path": "evidence/template-releases/REL-0003/technical-results/provenance.json",
      "sha256": "4a3d43507fcfeefead743f66ecd23d6f649a17af09ba8caadd08fdd588dcfb92",
      "media_type": "application/json",
      "category": "provenance"
    }
  ],
  "summary": "Category-specific provenance validation completed against the frozen release inputs.",
  "categories": [
    "provenance"
  ],
  "procedures": {
    "provenance": "Trace participants, attachment versions, and known facts to the approved world manifest."
  }
}
