{
  "schema_version": "1.0.0",
  "record_id": "EVID-REL-0002-TECH-LEAKAGE",
  "record_type": "technical_validation",
  "release_id": "REL-0002",
  "template_id": "TMPL-0002",
  "version": "1.0.0",
  "descriptor_sha256": "2d44a466e4c4a5da4bf0203b89ce6af3fcffe8a2e7e61ac6324f12bc7882472b",
  "native_asset_sha256s": [
    "1a922e87a29682bdea8a04734084f9f9fe1631bf785139b95b2b0f74c238818f"
  ],
  "verdict": "VALIDATION_PASS",
  "actor_id": "syn-validation-runner-2026-08-29",
  "actor": "Syn Studios validation runner",
  "observations": [
    "The blueprint leakage gate was executed for the frozen artifact set."
  ],
  "artifacts": [
    {
      "path": "evidence/template-releases/REL-0002/proofs/technical-leakage.txt",
      "sha256": "bc66146953dec139660e9134b585064487e4ddcb62856f57901e9a2f2c8380c2",
      "media_type": "text/plain",
      "category": "leakage"
    }
  ],
  "summary": "Technical validation result for the leakage release gate.",
  "categories": [
    "leakage"
  ],
  "procedures": {
    "leakage": "Scan body, appendices, comments, revisions, and metadata for prohibited residue."
  }
}
