{
  "schema_version": "1.0.0",
  "record_id": "EVID-REL-0003-TECH-COMPUTATIONAL",
  "record_type": "technical_validation",
  "release_id": "REL-0003",
  "template_id": "TMPL-0003",
  "version": "1.0.0",
  "descriptor_sha256": "850e4665fc96a18aab826296243c6f86e0af3833f1dea60547a62049e2559dfe",
  "native_asset_sha256s": [
    "8acaf754686fa23b1bbc59d229094d6444b54224ea9a0dae53c50086b8c5bf99"
  ],
  "verdict": "VALIDATION_NOT_APPLICABLE",
  "actor_id": "syn-validation-runner-2026-08-29",
  "actor": "Syn Studios validation runner",
  "observations": [
    "Deterministic computational checks inspected the frozen descriptor and all 1 bound native assets."
  ],
  "artifacts": [
    {
      "path": "evidence/template-releases/REL-0003/technical-results/computational.json",
      "sha256": "56fdc96c11569e88d6b8eb7f47e9acff5c71248113f374e41da0bec69e839c6c",
      "media_type": "application/json",
      "category": "computational"
    }
  ],
  "summary": "Category-specific computational validation completed against the frozen release inputs.",
  "categories": [
    "computational"
  ],
  "procedures": {
    "computational": "Confirm the email body contains no material calculation contract."
  }
}
