{
  "schema_version": "1.0.0",
  "record_id": "EVID-REL-0001-TECH-ANTI-FILLER",
  "record_type": "technical_validation",
  "release_id": "REL-0001",
  "template_id": "TMPL-0001",
  "version": "1.0.0",
  "descriptor_sha256": "642d3c4d81d898667606140d4f50ca0c040f66c2bf602312bc57a40aea318c7c",
  "native_asset_sha256s": [
    "2b439f61fce015d4d3b3c78368e8deb66b8ca811d799339c848c83c47edbdf66"
  ],
  "verdict": "VALIDATION_PASS",
  "actor_id": "syn-validation-runner-2026-08-29",
  "actor": "Syn Studios validation runner",
  "observations": [
    "Deterministic anti_filler checks inspected the frozen descriptor and all 1 bound native assets."
  ],
  "artifacts": [
    {
      "path": "evidence/template-releases/REL-0001/technical-results/anti_filler.json",
      "sha256": "b4931e78233d5aac8069337751370feed46486b7d474bc97426307244827a9a5",
      "media_type": "application/json",
      "category": "anti_filler"
    }
  ],
  "summary": "Category-specific anti_filler validation completed against the frozen release inputs.",
  "categories": [
    "anti_filler"
  ],
  "procedures": {
    "anti_filler": "Map every tab and material range to a producer-owned close workflow purpose."
  }
}
