{
  "schema_version": "1.0.0",
  "record_id": "EVID-REL-0003-TECH-CORE-INTEGRITY",
  "record_type": "technical_validation",
  "release_id": "REL-0003",
  "template_id": "TMPL-0003",
  "version": "1.0.0",
  "descriptor_sha256": "850e4665fc96a18aab826296243c6f86e0af3833f1dea60547a62049e2559dfe",
  "native_asset_sha256s": [
    "8acaf754686fa23b1bbc59d229094d6444b54224ea9a0dae53c50086b8c5bf99"
  ],
  "verdict": "VALIDATION_PASS",
  "actor_id": "syn-validation-runner-2026-08-29",
  "actor": "Syn Studios validation runner",
  "observations": [
    "Deterministic core_integrity checks inspected the frozen descriptor and every native asset byte."
  ],
  "artifacts": [
    {
      "path": "evidence/template-releases/REL-0003/technical-results/core_integrity.json",
      "sha256": "a9a75e0a9439b7db189d3c548939654a5f1216cbeb05f83800179aa5a2a7c7c6",
      "media_type": "application/json",
      "category": "core_integrity"
    }
  ],
  "summary": "Category-specific core_integrity validation completed against the frozen release inputs.",
  "categories": [
    "core_integrity"
  ],
  "procedures": {
    "core_integrity": "Parse MIME structure and verify thread order, headers, attachments, and correction state."
  }
}
