{
  "schema_version": "1.0.0",
  "record_id": "EVID-REL-0001-TECH-COMPUTATIONAL",
  "record_type": "technical_validation",
  "release_id": "REL-0001",
  "template_id": "TMPL-0001",
  "version": "1.0.0",
  "descriptor_sha256": "642d3c4d81d898667606140d4f50ca0c040f66c2bf602312bc57a40aea318c7c",
  "native_asset_sha256s": [
    "2b439f61fce015d4d3b3c78368e8deb66b8ca811d799339c848c83c47edbdf66"
  ],
  "verdict": "VALIDATION_PASS",
  "actor_id": "syn-validation-runner-2026-08-29",
  "actor": "Syn Studios validation runner",
  "observations": [
    "The blueprint computational gate was executed for the frozen artifact set."
  ],
  "artifacts": [
    {
      "path": "evidence/template-releases/REL-0001/proofs/technical-computational.txt",
      "sha256": "55b824db9688c92ac96e0c378511cb0b1d77f9e87c47fea48bf906ca75fef594",
      "media_type": "text/plain",
      "category": "computational"
    }
  ],
  "summary": "Technical validation result for the computational release gate.",
  "categories": [
    "computational"
  ],
  "procedures": {
    "computational": "Recalculate every formula and verify material totals and error states."
  }
}
